{
  "schemaVersion": 1,
  "id": "aea-account-state-classification",
  "version": 1,
  "title": "Account-state classification distinguishes hybrid and non-E2EE literals",
  "module": "WAWebAeaAccountState",
  "export": "isAeaNonE2eeAccountState",
  "context": {
    "clock": "2026-10-26T00:00:00.000Z",
    "timezone": "UTC",
    "randomSeed": 1,
    "gates": {}
  },
  "stubs": [
    {
      "module": "WAWebProtobufsAdv.pb",
      "exports": {}
    },
    {
      "module": "WAWebProtobufsAea.pb",
      "exports": {}
    }
  ],
  "probes": [
    {
      "id": "hybrid-account",
      "args": [
        "hybrid_e2ee"
      ],
      "expected": true
    },
    {
      "id": "non-e2ee-account",
      "args": [
        "non_e2ee"
      ],
      "expected": true
    },
    {
      "id": "e2ee-account",
      "args": [
        "e2ee"
      ],
      "expected": false
    },
    {
      "id": "not-set",
      "args": [
        "not_set"
      ],
      "expected": false
    },
    {
      "id": "unknown-literal",
      "args": [
        "HOSTED"
      ],
      "expected": false
    },
    {
      "id": "null-state",
      "args": [
        null
      ],
      "expected": false
    },
    {
      "id": "undefined-state",
      "args": [
        {
          "$type": "undefined"
        }
      ],
      "expected": false
    }
  ],
  "sourceExpectation": {
    "baselineRevision": "1051710191",
    "candidateRevision": "1051908825",
    "moduleLines": "6-14",
    "scope": "The exported predicate uses the actual archived enum to classify supplied state strings."
  }
}
